{
  "schemaVersion": "p2-execution-baseline-attestation.v1",
  "attestationId": "p2eba_48a4e4eac1f2_e6282c301d6e",
  "predicateType": "urn:multi-enterprise-ai-platform:p2-execution-baseline-attestation:v1",
  "canonicalization": "PROJECT_CANONICAL_JSON_V1_NOT_RFC8785",
  "source": {
    "commit": "48a4e4eac1f2fc2404d21ca5ab9a2d014a0e20e5",
    "tree": "49b9fab6215fe985352473edfc46bd068302d61e",
    "objectType": "commit"
  },
  "executionBaseline": {
    "recipePath": "implementation/p2/acceptance/p2-execution-baseline-recipe.v1.json",
    "recipeSha256": "sha256:43289d9784888585ad427b723370e89debc3a67bf14e424b4bfb41e101bc37ef",
    "digest": "sha256:e6282c301d6eb05cace8361f5974143897db59c3770d4c8856211f0635599bee"
  },
  "subjects": [
    {
      "kind": "PROFILE",
      "name": "p2-acceptance-profile-v2-candidate",
      "path": "implementation/p2/acceptance/p2-acceptance-profile.v2.candidate.json",
      "version": "p2-acceptance-profile.v2",
      "sha256": "sha256:90a9741d6ae39012458f073523da0c7b4dc8e4eef53ea759b32d6640e6aaef32"
    },
    {
      "kind": "SCHEMA",
      "name": "p2-acceptance-receipt-v2-schema",
      "path": "implementation/p2/acceptance/p2-acceptance-receipt.v2.schema.json",
      "version": "p2-acceptance-receipt.v2",
      "sha256": "sha256:f995310688c620b24c42b058fb6305b00876e0dfa0b8a755f41f827bfcb700bf"
    },
    {
      "kind": "VALIDATOR",
      "name": "p2-acceptance-receipt-semantic-validator",
      "path": "lib/p2-acceptance-receipt-validator.mjs",
      "version": "p2-acceptance-validator.v2",
      "sha256": "sha256:ae2b169b81f7769dfa952d0393b770e7a547f378989ab25a75ef62276f349200"
    },
    {
      "kind": "FIXTURE",
      "name": "c06-synthetic-authorization-fixtures",
      "path": "implementation/p1/c06/synthetic-authorization-fixtures.v1.json",
      "version": "c06-authorization-fixtures-v1",
      "sha256": "sha256:2c46d1c46eafaf5aebbfe7382cd16a9138a1c2cf142ca581ae101b254ebda130"
    },
    {
      "kind": "TOOL_LOCK",
      "name": "npm-package-lock",
      "path": "package-lock.json",
      "version": "3",
      "sha256": "sha256:6d5832c95b23aa8386d5a6f69e51d6346666d6abe233ab766154c74beec83c86"
    }
  ],
  "buildVerification": {
    "method": "BUILD_TIME_LOCAL_GIT_OBJECT_READ",
    "builderId": "multi-enterprise-ai-platform/p2-execution-baseline-attestation-builder",
    "builderVersion": "1.0.0",
    "result": "VERIFIED",
    "verifiedAt": "2026-07-28T08:07:06.000Z"
  },
  "generatedAt": "2026-07-28T08:07:06.000Z"
}
